{
  "schema_version": "ccem.candidate_subgraph/v0.3",
  "package_type": "candidate_subgraph",
  "case_id": "case_demo_rapid_001",
  "graph": {
    "directed": true,
    "multigraph": true,
    "time_unit": "second",
    "time_precision": 1.0,
    "time_quantization": "ROUND_HALF_UP",
    "time_origin": "2026-01-03T00:00:00Z",
    "amount_mode": "dual_endpoint",
    "nodes": [
      {"node_id": "DEMO::__NO_BANK__::source", "attrs": {}},
      {"node_id": "DEMO::__NO_BANK__::middle", "attrs": {}},
      {"node_id": "DEMO::__NO_BANK__::target", "attrs": {}}
    ],
    "edges": [
      {
        "edge_id": "source_e_001__mut__attack_demo_001__0",
        "src": "DEMO::__NO_BANK__::source",
        "dst": "DEMO::__NO_BANK__::middle",
        "timestamp": 100,
        "base_amount": 1000.0,
        "base_currency": "USD",
        "amount_sent": 1000.0,
        "sent_currency": "USD",
        "amount_received": 1000.0,
        "receiving_currency": "USD",
        "transaction_type": "TRANSFER",
        "payment_format": "ACH",
        "scope": "candidate",
        "parent_edge_ids": ["source_e_001"],
        "mutation_role": "modified"
      },
      {
        "edge_id": "source_e_002__mut__attack_demo_001__1",
        "src": "DEMO::__NO_BANK__::middle",
        "dst": "DEMO::__NO_BANK__::target",
        "timestamp": 1000,
        "base_amount": 950.0,
        "base_currency": "USD",
        "amount_sent": 950.0,
        "sent_currency": "USD",
        "amount_received": 950.0,
        "receiving_currency": "USD",
        "transaction_type": "TRANSFER",
        "payment_format": "ACH",
        "scope": "candidate",
        "parent_edge_ids": ["source_e_002"],
        "mutation_role": "modified"
      }
    ]
  },
  "analysis_context": {
    "requested_validation_target": "aml_outcome",
    "suggested_treatment": "rapid_transfer",
    "analysis_unit": "account_day",
    "anchor_time": "2026-01-03T00:00:00Z",
    "lookback_days": 7,
    "outcome_days": 1,
    "population_artifact": {
      "artifact_id": "demo-ibm-aml-v03",
      "format": "csv",
      "uri": "artifact://demo-ibm-aml-v03",
      "sha256": "a111f47d2917489d6ff75733e6a3a9b2135c7462842fce8c784761c1c1bdce38",
      "dataset_id": "DEMO"
    },
    "outcome_ref": {
      "artifact_id": "demo-ibm-aml-v03",
      "join_key": "transaction_row",
      "label_field": "Is Laundering",
      "allowed_consumers": ["CausalValidator", "FinalEvaluator"]
    }
  },
  "mutation": {
    "attack_id": "attack_demo_001",
    "attack_type": "temporal_stretch",
    "parameters": {"delay_seconds": 900},
    "attack_success": true,
    "base_retrieved": true,
    "mutated_retrieved": false,
    "failure_stage": "retrieval",
    "candidate_source": "mutation_scope",
    "old_rule_result": {"before_attack": true, "after_attack": false},
    "base_case_features": {},
    "mutated_case_features": {},
    "stable_features": ["amount_continuity", "currency"],
    "changed_features": ["time_gap"],
    "failed_rule_conditions": ["retrieval_rank_below_threshold"],
    "edge_lineage": [
      {
        "edge_id": "source_e_001__mut__attack_demo_001__0",
        "parent_edge_ids": ["source_e_001"],
        "mutation_role": "modified"
      },
      {
        "edge_id": "source_e_002__mut__attack_demo_001__1",
        "parent_edge_ids": ["source_e_002"],
        "mutation_role": "modified"
      }
    ]
  },
  "provenance": {
    "round": 1,
    "generator": "candidate-package-builder/v0.3",
    "parent_motif": "rapid_transfer",
    "mutation_ops": ["add_delay"],
    "source_dataset_id": "DEMO",
    "source_artifact_sha256": "a111f47d2917489d6ff75733e6a3a9b2135c7462842fce8c784761c1c1bdce38",
    "generator_version": "0.3.0",
    "created_at": "2026-08-22T00:00:00Z",
    "random_seed": 42
  }
}
